{
  "$defs": {
    "artifact_class": {
      "description": "Closed set; unknown must fail closed",
      "enum": [
        "final_accept",
        "fixture_expected",
        "fixture",
        "live_regen",
        "Git-raw",
        "Git-mid",
        "Gold-final",
        "Rewrite-map-confirmed",
        "Opik-unbound",
        "plan_only",
        "trajectory_only",
        "train_row",
        "export_batch"
      ],
      "type": "string"
    },
    "authority": {
      "enum": [
        "law",
        "advisory",
        "lab",
        "ops",
        "projection"
      ],
      "type": "string"
    },
    "family": {
      "enum": [
        "A",
        "B",
        "C",
        "D",
        "E",
        "F",
        "G",
        "H",
        "I",
        "Cprime",
        "human",
        "lab",
        "dogfood",
        "gate",
        "binding",
        "export",
        "nlp"
      ],
      "type": "string"
    },
    "feedback_target": {
      "enum": [
        "trace",
        "span",
        "thread",
        "artifact"
      ],
      "type": "string"
    },
    "input_artifact": {
      "enum": [
        "final_message",
        "plan",
        "bundle",
        "trajectory",
        "fixture_envelope",
        "judge_input"
      ],
      "type": "string"
    },
    "non_empty_string": {
      "minLength": 1,
      "type": "string"
    },
    "pin_ref": {
      "pattern": "^[a-z0-9_]+_v[0-9]+@([a-f0-9]{64}|[A-Za-z0-9._-]+)$",
      "type": "string"
    },
    "polarity": {
      "enum": [
        "higher_is_better",
        "lower_is_better",
        "pass_fail"
      ],
      "type": "string"
    },
    "provenance_label": {
      "enum": [
        "Git-raw",
        "Git-mid",
        "Gold-final",
        "Rewrite-map-confirmed",
        "Opik-unbound",
        "final_accept",
        "live_regen",
        "fixture"
      ],
      "type": "string"
    },
    "redaction_profile": {
      "description": "R14 owner redaction ladder",
      "enum": [
        "public_ci",
        "default_scrub",
        "private_message",
        "train_rich",
        "antipattern_vault",
        "message_only",
        "meta_eval_scrub",
        "raw_dev_unsafe"
      ],
      "type": "string"
    },
    "severity": {
      "enum": [
        "block",
        "warn",
        "info"
      ],
      "type": "string"
    },
    "sha256": {
      "pattern": "^[a-f0-9]{64}$",
      "type": "string"
    },
    "source": {
      "enum": [
        "local_wrapper",
        "lane_c_judge",
        "human",
        "lab_meta",
        "export_health"
      ],
      "type": "string"
    }
  },
  "$id": "https://git-cg.local/schemas/eval/dataset_snapshot_v1.schema.json",
  "$schema": "https://json-schema.org/draft/2020-12/schema",
  "additionalProperties": false,
  "description": "Pinned dataset snapshot. S0 stub: identifiers + closed enums + representative required fields.",
  "properties": {
    "id": {
      "$ref": "#/$defs/non_empty_string"
    },
    "item_count": {
      "minimum": 0,
      "type": "integer"
    },
    "meta": {
      "type": "object"
    },
    "metric_catalog": {
      "type": "string"
    },
    "notes": {
      "type": "string"
    },
    "schema_pack": {
      "type": "string"
    },
    "schema_version": {
      "const": "dataset_snapshot_v1"
    },
    "snapshot_hash": {
      "type": "string"
    }
  },
  "required": [
    "schema_version",
    "id",
    "snapshot_hash"
  ],
  "title": "dataset_snapshot_v1",
  "type": "object"
}
