{
  "id": "snapshot:204-archive",
  "item_count": 6,
  "meta": {
    "case_ids": [
      "seed-a1-session12-regime-a",
      "seed-b1-session12-regime-b",
      "seed-b2-session12-g3",
      "seed-b3-session12-g4",
      "seed-b4-quality-package-dogfood",
      "seed-a2-instance-a-precursor"
    ],
    "items": [
      {
        "artifact_class": "fixture_expected",
        "bundle_hash": "70bf37a10cd95bcf9013c04c0031e89bdd7f1c2866e50a31353ef6057eaa57de",
        "bundle_ref": "bundle:seed-a1-session12-regime-a@70bf37a10cd95bcf9013c04c0031e89bdd7f1c2866e50a31353ef6057eaa57de",
        "case_hash": "144ecdf0852fd75728ecd906dd5a10b2fd8204338d24aa9b9613b877c0819a49",
        "case_id": "seed-a1-session12-regime-a"
      },
      {
        "artifact_class": "fixture_expected",
        "bundle_hash": "d1591fc82203ef7ed69c15155d98fb19856bb4d49d040cc39910d536be9fddd3",
        "bundle_ref": "bundle:seed-b1-session12-regime-b@d1591fc82203ef7ed69c15155d98fb19856bb4d49d040cc39910d536be9fddd3",
        "case_hash": "e5d8f683cebdea557726af6319a2b9b0b30f98216ce9190fcf62cab8c35097f6",
        "case_id": "seed-b1-session12-regime-b"
      },
      {
        "artifact_class": "fixture_expected",
        "bundle_hash": "a35d1de8d74f1c41a074222b550bf0c9d15f166de9a2e961420bf3680e5156c1",
        "bundle_ref": "bundle:seed-b2-session12-g3@a35d1de8d74f1c41a074222b550bf0c9d15f166de9a2e961420bf3680e5156c1",
        "case_hash": "0339ac2b2848db61f1f1034dbcb1d1b583451c7528027389b49b5f3346bc1519",
        "case_id": "seed-b2-session12-g3"
      },
      {
        "artifact_class": "fixture_expected",
        "bundle_hash": "85b579883a1fb2e57ee61d1c2b13336504ff1096cad7462f32c65f46816c24d2",
        "bundle_ref": "bundle:seed-b3-session12-g4@85b579883a1fb2e57ee61d1c2b13336504ff1096cad7462f32c65f46816c24d2",
        "case_hash": "3447bbe8d0b1c7f9f9671197f778cbcc9831bf82ec0a0e9e93d8b0c045e0236a",
        "case_id": "seed-b3-session12-g4"
      },
      {
        "artifact_class": "fixture_expected",
        "bundle_hash": "0614f810c151f15ff723d3aae306a95b6e924238a450de773aaeaa006efe51e1",
        "bundle_ref": "bundle:seed-b4-quality-package-dogfood@0614f810c151f15ff723d3aae306a95b6e924238a450de773aaeaa006efe51e1",
        "case_hash": "823f25a9024a01513fa102381600ca6659b174f818935d348f22f1cb2a66254f",
        "case_id": "seed-b4-quality-package-dogfood"
      },
      {
        "artifact_class": "fixture_expected",
        "bundle_hash": "951e748a5fce5c42cc686db5b7d10909e5b4c95b6b46c5933a41962c98ffe6da",
        "bundle_ref": "bundle:seed-a2-instance-a-precursor@951e748a5fce5c42cc686db5b7d10909e5b4c95b6b46c5933a41962c98ffe6da",
        "case_hash": "ce94d3e104c922c9a4badf327b36d3552d3bb281aa645cb67b8ea6ba105f65f5",
        "case_id": "seed-a2-instance-a-precursor"
      }
    ],
    "network_policy": "offline_required",
    "producer": "fixture_encoder_s1",
    "suite_id": "204-archive"
  },
  "metric_catalog": "metric_catalog_v0@430a62c1d7971e1145cfffd41e608a5f6bd39d284a3d050f991b8537f817eb75",
  "notes": "Offline Lane A snapshot for 204-archive",
  "schema_pack": "schema_pack_v0@8616781fb87ea4721253f7efacf120c7c602062a6c578b8a4173fbae5341c3c3",
  "schema_version": "dataset_snapshot_v1",
  "snapshot_hash": "85a3bbf4511dabffe99ad6d41de6de8c1b898cee81ac0be1aeebf842b221dbc1"
}
