{
  "id": "snapshot:cm-eval-fixtures-core",
  "item_count": 3,
  "meta": {
    "case_ids": [
      "seed-v1-valid-fixture",
      "seed-a1-session12-regime-a",
      "seed-b1-session12-regime-b"
    ],
    "items": [
      {
        "artifact_class": "fixture_expected",
        "bundle_hash": "50eaa761e1cc90ad42b02c1894095648181d9796757dcf81e507088ad3ec10fe",
        "bundle_ref": "bundle:seed-v1-valid-fixture@50eaa761e1cc90ad42b02c1894095648181d9796757dcf81e507088ad3ec10fe",
        "case_hash": "0204d2b87966e7c98fa7cef9e39877b2af876b1ad9b75f5418a8c52d275eeee3",
        "case_id": "seed-v1-valid-fixture"
      },
      {
        "artifact_class": "fixture_expected",
        "bundle_hash": "6ca3137b4fd5c6fb12056053f25ee78df6a2ee80d5603b667b29ea3bcd1e204b",
        "bundle_ref": "bundle:seed-a1-session12-regime-a@6ca3137b4fd5c6fb12056053f25ee78df6a2ee80d5603b667b29ea3bcd1e204b",
        "case_hash": "a2864488e4da54b7c302fdb4a15ce27eb1954ca5aef568eb7c41b7ecfaecc943",
        "case_id": "seed-a1-session12-regime-a"
      },
      {
        "artifact_class": "fixture_expected",
        "bundle_hash": "673d0693f80dabeeb71cff416ddd2163c3a73f467d4324e2da237eafcd104383",
        "bundle_ref": "bundle:seed-b1-session12-regime-b@673d0693f80dabeeb71cff416ddd2163c3a73f467d4324e2da237eafcd104383",
        "case_hash": "fc3ff7d29e30b701d71bf716ca988eebde6948ee7800c632d5a97281c7e191a5",
        "case_id": "seed-b1-session12-regime-b"
      }
    ],
    "network_policy": "offline_required",
    "producer": "fixture_encoder_s1",
    "suite_id": "cm-eval-fixtures-core"
  },
  "metric_catalog": "metric_catalog_v0@430a62c1d7971e1145cfffd41e608a5f6bd39d284a3d050f991b8537f817eb75",
  "notes": "Offline Lane A snapshot for cm-eval-fixtures-core",
  "schema_pack": "schema_pack_v0@50e7fbea5af7de178ea1852bf314fc33c636aa39ef4c0cb7469a9b15a4520917",
  "schema_version": "dataset_snapshot_v1",
  "snapshot_hash": "03fc43cfc2872ae1ff7c3df1c10cc09d9ef0c077b3e0bfad7a6bb4fef96f0b67"
}
